{
  "$schema": "https://json-schema.org/draft/2020-12/schema",
  "$id": "https://bptrade.co/data/journal-schema.json",
  "title": "The Blueprint - trade record",
  "description": "A single journal trade record. Field model: reference/TAXONOMY.md sections 1.1 and 1.2. Vocabularies: sections 2, 3, 4 and 5. Slugs are immutable (TAXONOMY section 0); labels live in js/journal/schema.js and may change freely.",
  "$comment": "Schema v3: setup, location and grade are nullable (present, never absent) so zero-touch captures validate. The top-level if/then rejects null for all three when environment is live and exit_time is set (a closed live trade); validate() in js/journal/schema.js enforces the same rule, and scripts/validate-journal.mjs evaluates if/then. Anything generating checks from this file must carry the if/then. Selectable values only. Reserved but INACTIVE location slugs (london-high, london-low, asia-high, asia-low; TAXONOMY 4.1) are deliberately absent until the NT8 fix ships. Confirmation values other than the four aggression-fails sub-forms (Trapped Traders; Trader Dale's four; TAXONOMY 3.4) have no slugs yet and are absent until TAXONOMY assigns them.",
  "type": "object",
  "additionalProperties": false,
  "required": [
    "taxonomy_version",
    "setup",
    "location",
    "grade",
    "environment",
    "instrument",
    "direction",
    "session_date",
    "entry_time",
    "exit_price",
    "account",
    "account_type",
    "target_2"
  ],
  "if": {
    "properties": {
      "environment": { "const": "live" },
      "exit_time": { "type": "string" }
    },
    "required": ["environment", "exit_time"]
  },
  "then": {
    "description": "A closed live trade is fully classified: setup, location and grade must be non-null.",
    "properties": {
      "setup": { "type": "string" },
      "location": { "type": "string" },
      "grade": { "type": "string" }
    }
  },
  "properties": {
    "id": {
      "description": "Record id: the session date plus a short random suffix (for example 2026-09-29-k3f9a), so ids sort by date. Optional on input; the storage layer assigns one on put.",
      "type": ["string", "null"],
      "pattern": "^[0-9]{4}-[0-9]{2}-[0-9]{2}-[0-9a-z]{4,12}$"
    },
    "taxonomy_version": {
      "description": "TAXONOMY version the trade was tagged under, stamped at write time (section 0). Any major.minor version number: records from older taxonomy versions stay valid. Whether the version is newer than the supported one is checked by validate() in js/journal/schema.js, which a pattern cannot express.",
      "type": "string",
      "pattern": "^[0-9]+[.][0-9]+$"
    },

    "setup": {
      "description": "Exactly 1 once classified. Null on an unclassified zero-touch capture (schema v3). The read: what price is doing (section 2).",
      "enum": ["trend-continuation", "range-rejection", "gap-fill", "gap-n-go", "no-setup", null]
    },
    "location": {
      "description": "Exactly 1 once classified. Null on an unclassified zero-touch capture (schema v3). Where it happened: the named level or level type (section 4). mid-range means no named level.",
      "enum": [
        "pd-high", "pd-low", "pd-vah", "pd-val", "pd-vpoc", "settlement",
        "on-high", "on-low", "on-poc",
        "prior-week-high", "prior-week-low",
        "htf-hvn", "htf-lvn",
        "or-high", "or-low",
        "defended-pullback-high", "defended-pullback-low",
        "developing-vpoc", "developing-vah", "developing-val",
        "unfinished-business", "stacked-imbalance",
        "mid-range",
        null
      ]
    },
    "trigger": {
      "description": "0 or 1. The entry event, and it is a PRICE event (section 3). Absent or null when nothing fired; none is the explicit no-trigger slug (3.6). Order-flow evidence is never a trigger: it goes in confirmation.",
      "enum": ["pause-n-go", "resting-limit", "ema-pullback", "level-reclaim", "none", null]
    },
    "confirmation": {
      "description": "0 or many. Order-flow evidence supporting the entry (section 3.4). Separate from trigger. Each value is an aggression-fails sub-form, so the sub-form that 3.4 requires is always present.",
      "type": ["array", "null"],
      "uniqueItems": true,
      "items": {
        "enum": ["big-orders", "failing-delta", "delta-divergence", "two-bar-exhaustion"]
      }
    },
    "grade": {
      "description": "Exactly 1 once classified. Null on an unclassified zero-touch capture (schema v3). Entry-plan compliance only, assigned at entry and never reading the outcome (section 5.1). Exit compliance is execution_mark.",
      "enum": ["A+", "A", "B", "C", null]
    },
    "execution_mark": {
      "description": "Exactly 1 once the trade has exited; null until then. Did the exit follow the plan (section 5.2). Separate from grade.",
      "enum": ["Pass", "Fail", null]
    },
    "environment": {
      "description": "Exactly 1, required on every record. Sim is counted separately and never pooled into expectancy (section 6.4).",
      "enum": ["live", "sim", "replay"]
    },
    "account": {
      "description": "The account the trade was recorded on. Free text, no enum. Null for records that predate the field (schema v5). Required as a key.",
      "type": ["string", "null"]
    },
    "account_type": {
      "description": "The kind of account the trade was recorded on. Null for records that predate the field (schema v5). Required as a key.",
      "enum": ["cash", "apex", "lucid", "sim", null]
    },
    "tags": {
      "description": "0 or many. Process and behavioral tags (section 5). TAXONOMY does not enumerate tag values, so any non-empty string is accepted. legacy_ tags are not selectable on new trades.",
      "type": ["array", "null"],
      "uniqueItems": true,
      "items": { "type": "string", "minLength": 1 }
    },

    "instrument": {
      "description": "Identity (section 1.2).",
      "type": "string",
      "minLength": 1
    },
    "direction": {
      "description": "Identity (section 1.2). TAXONOMY does not list the values; long and short.",
      "enum": ["long", "short"]
    },
    "session_date": {
      "description": "Trading session date, YYYY-MM-DD.",
      "type": "string",
      "pattern": "^[0-9]{4}-[0-9]{2}-[0-9]{2}$"
    },
    "entry_time": {
      "description": "ISO 8601 date-time with a UTC offset.",
      "type": "string",
      "pattern": "^[0-9]{4}-[0-9]{2}-[0-9]{2}T[0-9]{2}:[0-9]{2}:[0-9]{2}([.][0-9]+)?(Z|[+-][0-9]{2}:[0-9]{2})$"
    },
    "exit_time": {
      "description": "ISO 8601 date-time with a UTC offset. Absent or null while the trade is open.",
      "type": ["string", "null"],
      "pattern": "^[0-9]{4}-[0-9]{2}-[0-9]{2}T[0-9]{2}:[0-9]{2}:[0-9]{2}([.][0-9]+)?(Z|[+-][0-9]{2}:[0-9]{2})$"
    },

    "intended_price": {
      "description": "Where the plan said to get filled, in price points.",
      "type": ["number", "null"]
    },
    "actual_fill": {
      "description": "Where the fill happened, in price points. actual_fill minus intended_price is the fill-placement gap.",
      "type": ["number", "null"]
    },
    "exit_price": {
      "description": "Size-weighted average exit price, in price points, rounded to the instrument tick. Null while the trade is open. Required as a key (schema v4).",
      "type": ["number", "null"]
    },
    "stop_price": {
      "description": "Plan geometry, for grade evaluation. Price points.",
      "type": ["number", "null"]
    },
    "target_price": {
      "description": "Plan geometry, for grade evaluation. Price points. The first target, and the one planned R:R is measured against.",
      "type": ["number", "null"]
    },
    "target_2": {
      "description": "The second target where a plan uses two: the runner. Price points. Null when the plan has one target. Required as a key (schema v5).",
      "type": ["number", "null"]
    },
    "size": {
      "description": "Position size in contracts.",
      "type": ["integer", "null"],
      "minimum": 1
    },

    "r_multiple": {
      "description": "Outcome in R, a multiple of the planned risk. Null while the trade is open.",
      "type": ["number", "null"]
    },
    "mae_ticks": {
      "description": "Maximum adverse excursion, in ticks, as a positive magnitude. TAXONOMY 1.2 field mae.",
      "type": ["number", "null"],
      "minimum": 0
    },
    "mfe_ticks": {
      "description": "Maximum favorable excursion, in ticks, as a positive magnitude. TAXONOMY 1.2 field mfe.",
      "type": ["number", "null"],
      "minimum": 0
    },
    "time_in_trade_seconds": {
      "description": "Seconds from entry to exit. TAXONOMY 1.2 field time_in_trade.",
      "type": ["number", "null"],
      "minimum": 0
    },
    "commissions": {
      "description": "US dollars, the total for the whole trade (all contracts, both sides). Gate 2 expectancy is after commissions.",
      "type": ["number", "null"],
      "minimum": 0
    }
  }
}
