{
  "id": "2026-10-06-p8w3d5nc",
  "taxonomy_version": "1.4",
  "setup": null,
  "location": null,
  "trigger": null,
  "confirmation": null,
  "grade": null,
  "execution_mark": null,
  "environment": "sim",
  "account": null,
  "account_type": null,
  "tags": ["zero-touch"],
  "instrument": "MES",
  "direction": "long",
  "session_date": "2026-10-06",
  "entry_time": "2026-10-06T10:22:41-04:00",
  "exit_time": null,
  "intended_price": null,
  "actual_fill": 6012.25,
  "exit_price": null,
  "stop_price": null,
  "target_price": null,
  "target_2": null,
  "size": 1,
  "r_multiple": null,
  "mae_ticks": null,
  "mfe_ticks": null,
  "time_in_trade_seconds": null,
  "commissions": null
}
