{
  "id": "2026-10-06-c7n2v9hk",
  "taxonomy_version": "1.4",
  "setup": null,
  "location": null,
  "trigger": null,
  "confirmation": null,
  "grade": null,
  "execution_mark": null,
  "environment": "live",
  "account": "Sim101",
  "account_type": "sim",
  "tags": ["zero-touch"],
  "instrument": "MES",
  "direction": "short",
  "session_date": "2026-10-06",
  "entry_time": "2026-10-06T10:22:41-04:00",
  "exit_time": "2026-10-06T10:48:09-04:00",
  "intended_price": null,
  "actual_fill": 6012.25,
  "exit_price": 6009.50,
  "stop_price": null,
  "target_price": null,
  "target_2": null,
  "size": 1,
  "r_multiple": null,
  "mae_ticks": 6,
  "mfe_ticks": 14,
  "time_in_trade_seconds": 1528,
  "commissions": 1.24
}
